batch_id,production_date,product_code,shift,operator_id,inspection_id,inspection_date,inspector_id,quality_score,defect_type,defect_severity,defect_count,rework_required,comments,factory_location
F1778-20240603,2024-06-03,PRD-01,afternoon,OP-1674,INSP-0006,2024-06-03 15:53:00,INS-3452,93.8,NO_DEFECT,0,0,False,Exceeded benchmarks. Batch PRD-01 is exemplary.,Factory-G9
G5762-20240604,2024-06-04,PRD-02,night,OP-2517,INSP-0007,2024-06-05 00:58:00,INS-5691,59.2,contamination,4,6,True,Contamination detected; batch must be reworked.,Factory-E1
H4893-20240604,2024-06-04,PRD-03,afternoon,OP-5691,INSP-0008,2024-06-04 16:02:00,INS-5648,78.3,dent,2,2,False,Minor dent noted but batch passes inspection.,Factory-A2
I6432-20240605,2024-06-05,PRD-04,morning,OP-0033,INSP-0009,2024-06-05 10:00:00,INS-4178,100.0,NO_DEFECT,0,0,False,No issues detected in PRD-04 batch.,Factory-Z3
J2084-20240605,2024-06-05,PRD-01,afternoon,OP-2186,INSP-0010,2024-06-05 15:05:00,INS-2517,82.0,marking,1,1,False,"Light marking observed, batch passes.",Factory-Y7
K7182-20240606,2024-06-06,PRD-03,morning,OP-7777,INSP-0011,2024-06-06 10:18:00,INS-0112,98.8,NO_DEFECT,0,0,False,"No defects, batch PRD-03 is acceptable.",Factory-X0
L6302-20240606,2024-06-06,PRD-02,night,OP-1674,INSP-0012,2024-06-07 01:10:00,INS-3452,41.5,mislabel,3,8,True,"Mislabeling detected, batch failed and requires rework.",Factory-G9
M4589-20240607,2024-06-07,PRD-04,afternoon,OP-5691,INSP-0013,2024-06-07 15:35:00,INS-5648,76.2,discoloration,2,1,False,"Minor discoloration, within tolerance.",Factory-E1
N1892-20240607,2024-06-07,PRD-01,morning,OP-2517,INSP-0014,2024-06-07 08:42:00,INS-5691,97.2,NO_DEFECT,0,0,False,"Excellent batch, PRD-01 passed all checks.",Factory-A2
O5732-20240608,2024-06-08,PRD-02,afternoon,OP-0033,INSP-0015,2024-06-08 16:00:00,INS-4178,63.0,cracking,4,7,True,"Cracking detected, batch failed and sent for rework.",Factory-Z3
P9210-20240609,2024-06-09,PRD-04,morning,OP-2186,INSP-0016,2024-06-09 09:10:00,INS-2517,99.5,NO_DEFECT,0,0,False,No issues. PRD-04 batch cleared for shipping.,Factory-Y7
Q1834-20240609,2024-06-09,PRD-03,night,OP-7777,INSP-0017,2024-06-10 00:45:00,INS-0112,44.6,contamination,3,4,True,Contamination above acceptable levels; batch sent for rework.,Factory-X0
R4675-20240610,2024-06-10,PRD-02,afternoon,OP-1674,INSP-0018,2024-06-10 15:30:00,INS-3452,88.4,NO_DEFECT,0,0,False,"High quality batch, no defects found.",Factory-G9
S2941-20240610,2024-06-10,PRD-01,morning,OP-5691,INSP-0019,2024-06-10 09:48:00,INS-5648,79.8,dent,2,2,False,"Minor dent observed, within quality tolerance.",Factory-E1
T8720-20240611,2024-06-11,PRD-03,afternoon,OP-2517,INSP-0020,2024-06-11 14:22:00,INS-5691,91.6,NO_DEFECT,0,0,False,Batch PRD-03 meets all quality requirements.,Factory-A2
U5423-20240611,2024-06-11,PRD-04,night,OP-0033,INSP-0021,2024-06-12 00:30:00,INS-4178,4.7,major_crack,4,17,True,Complete failure. Batch must be discarded.,Factory-Z3
V9181-20240612,2024-06-12,PRD-02,afternoon,OP-2186,INSP-0022,2024-06-12 15:00:00,INS-2517,100.0,NO_DEFECT,0,0,False,"Perfect batch, no issues detected.",Factory-Y7
W3615-20240612,2024-06-12,PRD-01,morning,OP-7777,INSP-0023,2024-06-12 11:45:00,INS-0112,86.5,NO_DEFECT,0,0,False,Batch PRD-01 passed without defects.,Factory-X0
X5072-20240613,2024-06-13,PRD-04,afternoon,OP-1674,INSP-0024,2024-06-13 16:10:00,INS-3452,71.2,foreign_object,1,1,False,"Minor foreign object detected, batch approved.",Factory-G9
Y6938-20240613,2024-06-13,PRD-03,night,OP-5691,INSP-0025,2024-06-14 02:05:00,INS-5648,58.9,cracking,3,5,True,"Cracking observed, batch requires rework.",Factory-E1
Z4039-20240614,2024-06-14,PRD-02,afternoon,OP-2517,INSP-0026,2024-06-14 14:50:00,INS-5691,95.0,NO_DEFECT,0,0,False,Batch PRD-02 meets all specs. No defects.,Factory-A2
A5016-20240614,2024-06-14,PRD-01,morning,OP-0033,INSP-0027,2024-06-14 09:35:00,INS-4178,80.4,discoloration,2,1,False,"Discoloration noted, batch approved.",Factory-Z3
B2783-20240615,2024-06-15,PRD-03,afternoon,OP-2186,INSP-0028,2024-06-15 14:35:00,INS-2517,67.3,misalignment,4,10,True,"Misalignment detected, batch failed.",Factory-Y7
C5401-20240615,2024-06-15,PRD-04,morning,OP-7777,INSP-0029,2024-06-15 08:40:00,INS-0112,97.8,NO_DEFECT,0,0,False,"No defects, batch passed.",Factory-X0
D3094-20240616,2024-06-16,PRD-01,afternoon,OP-1674,INSP-0030,2024-06-16 15:15:00,INS-3452,86.7,NO_DEFECT,0,0,False,Batch PRD-01 meets standards.,Factory-G9
E8257-20240616,2024-06-16,PRD-03,night,OP-5691,INSP-0031,2024-06-17 02:12:00,INS-5648,49.7,contamination,3,6,True,Batch requires rework due to contamination.,Factory-E1
F6324-20240617,2024-06-17,PRD-02,afternoon,OP-2517,INSP-0032,2024-06-17 14:37:00,INS-5691,89.1,NO_DEFECT,0,0,False,Batch PRD-02 cleared for shipment.,Factory-A2
G9310-20240617,2024-06-17,PRD-04,morning,OP-0033,INSP-0033,2024-06-17 10:10:00,INS-4178,74.5,scratch,1,2,False,"Minor scratch observed, batch passes.",Factory-Z3
H4281-20240618,2024-06-18,PRD-01,afternoon,OP-2186,INSP-0034,2024-06-18 16:00:00,INS-2517,99.1,NO_DEFECT,0,0,False,"Batch meets all requirements, no defects.",Factory-Y7
I9512-20240618,2024-06-18,PRD-03,morning,OP-7777,INSP-0035,2024-06-18 08:25:00,INS-0112,85.6,NO_DEFECT,0,0,False,No issues detected in morning shift batch.,Factory-X0
J7810-20240619,2024-06-19,PRD-02,night,OP-1674,INSP-0036,2024-06-20 01:49:00,INS-3452,52.3,mislabel,3,5,True,"Batch failed due to mislabel, rework required.",Factory-G9
K4018-20240619,2024-06-19,PRD-01,afternoon,OP-5691,INSP-0037,2024-06-19 14:25:00,INS-5648,62.8,misalignment,4,8,True,"Misalignment detected, batch sent for rework.",Factory-E1
L2384-20240620,2024-06-20,PRD-03,morning,OP-2517,INSP-0038,2024-06-20 10:30:00,INS-5691,99.7,NO_DEFECT,0,0,False,Batch PRD-03 rated excellent.,Factory-A2
M6097-20240620,2024-06-20,PRD-04,afternoon,OP-0033,INSP-0039,2024-06-20 16:10:00,INS-4178,83.9,marking,2,1,False,"Minor marking noted in batch, within tolerance.",Factory-Z3
N1839-20240621,2024-06-21,PRD-01,morning,OP-2186,INSP-0040,2024-06-21 09:10:00,INS-2517,100.0,NO_DEFECT,0,0,False,"Perfect batch, no defects.",Factory-Y7
O8342-20240621,2024-06-21,PRD-03,night,OP-7777,INSP-0041,2024-06-22 01:30:00,INS-0112,98.2,NO_DEFECT,0,0,False,Batch passed all inspections with high score.,Factory-X0
P3295-20240622,2024-06-22,PRD-02,afternoon,OP-1674,INSP-0042,2024-06-22 15:40:00,INS-3452,81.7,scratch,1,1,False,"Light scratch observed, batch passes.",Factory-G9
Q5091-20240622,2024-06-22,PRD-04,morning,OP-5691,INSP-0043,2024-06-22 11:15:00,INS-5648,92.3,NO_DEFECT,0,0,False,Batch PRD-04 is approved for shipment.,Factory-E1
R2806-20240623,2024-06-23,PRD-01,afternoon,OP-2517,INSP-0044,2024-06-23 14:10:00,INS-5691,60.4,misalignment,4,9,True,"Severe misalignment detected, batch sent for rework.",Factory-A2
S1935-20240623,2024-06-23,PRD-03,night,OP-0033,INSP-0045,2024-06-24 02:40:00,INS-4178,6.3,major_crack,4,19,True,Complete failure. Batch will be discarded.,Factory-Z3
T8452-20240624,2024-06-24,PRD-04,morning,OP-2186,INSP-0046,2024-06-24 08:55:00,INS-2517,97.5,NO_DEFECT,0,0,False,No defects found during inspection.,Factory-Y7
U3917-20240624,2024-06-24,PRD-01,afternoon,OP-7777,INSP-0047,2024-06-24 15:23:00,INS-0112,76.9,dent,2,1,False,"Minor dent found, batch passes.",Factory-X0
V8093-20240625,2024-06-25,PRD-03,night,OP-1674,INSP-0048,2024-06-26 00:03:00,INS-3452,47.5,contamination,3,6,True,Batch failed due to contamination.,Factory-G9
W5076-20240625,2024-06-25,PRD-02,afternoon,OP-5691,INSP-0049,2024-06-25 14:57:00,INS-5648,98.2,NO_DEFECT,0,0,False,Batch PRD-02 meets all benchmarks.,Factory-E1
X1834-20240626,2024-06-26,PRD-01,morning,OP-2517,INSP-0050,2024-06-26 11:13:00,INS-5691,100.0,NO_DEFECT,0,0,False,"Exceptional batch, no defects.",Factory-A2
