batch_id,production_date,product_code,shift,operator_id,inspection_id,inspection_date,inspector_id,quality_score,defect_type,defect_severity,defect_count,rework_required,comments,factory_location
J2084-20240605,2024-06-05,PRD-01,afternoon,OP-2186,INSP-0010,2024-06-05T15:05:00,INS-2517,82,marking,1,1,false,"Light marking observed, batch passes.",Factory-Y7
K7182-20240606,2024-06-06,PRD-03,morning,OP-7777,INSP-0011,2024-06-06T10:18:00,INS-0112,98.8,,,0,false,"No defects, batch PRD-03 is acceptable.",Factory-X0
L6302-20240606,2024-06-06,PRD-02,night,OP-1674,INSP-0012,2024-06-07T01:10:00,INS-3452,41.5,mislabel,3,8,true,"Mislabeling detected, batch failed and requires rework.",Factory-G9
M4589-20240607,2024-06-07,PRD-04,afternoon,OP-5691,INSP-0013,2024-06-07T15:35:00,INS-5648,76.2,discoloration,2,1,false,"Minor discoloration, within tolerance.",Factory-E1
N1892-20240607,2024-06-07,PRD-01,morning,OP-2517,INSP-0014,2024-06-07T08:42:00,INS-5691,97.2,,,0,false,"Excellent batch, PRD-01 passed all checks.",Factory-A2
O5732-20240608,2024-06-08,PRD-02,afternoon,OP-0033,INSP-0015,2024-06-08T16:00:00,INS-4178,63,cracking,4,7,true,"Cracking detected, batch failed and sent for rework.",Factory-Z3
P9210-20240609,2024-06-09,PRD-04,morning,OP-2186,INSP-0016,2024-06-09T09:10:00,INS-2517,99.5,,,0,false,No issues. PRD-04 batch cleared for shipping.,Factory-Y7
Q1834-20240609,2024-06-09,PRD-03,night,OP-7777,INSP-0017,2024-06-10T00:45:00,INS-0112,44.6,contamination,3,4,true,Contamination above acceptable levels; batch sent for rework.,Factory-X0
R4675-20240610,2024-06-10,PRD-02,afternoon,OP-1674,INSP-0018,2024-06-10T15:30:00,INS-3452,88.4,,,0,false,"High quality batch, no defects found.",Factory-G9
S2941-20240610,2024-06-10,PRD-01,morning,OP-5691,INSP-0019,2024-06-10T09:48:00,INS-5648,79.8,dent,2,2,false,"Minor dent observed, within quality tolerance.",Factory-E1
T8720-20240611,2024-06-11,PRD-03,afternoon,OP-2517,INSP-0020,2024-06-11T14:22:00,INS-5691,91.6,,,0,false,Batch PRD-03 meets all quality requirements.,Factory-A2
U5423-20240611,2024-06-11,PRD-04,night,OP-0033,INSP-0021,2024-06-12T00:30:00,INS-4178,4.7,major_crack,4,17,true,Complete failure. Batch must be discarded.,Factory-Z3
V9181-20240612,2024-06-12,PRD-02,afternoon,OP-2186,INSP-0022,2024-06-12T15:00:00,INS-2517,100,,,0,false,"Perfect batch, no issues detected.",Factory-Y7
W3615-20240612,2024-06-12,PRD-01,morning,OP-7777,INSP-0023,2024-06-12T11:45:00,INS-0112,86.5,,,0,false,Batch PRD-01 passed without defects.,Factory-X0
X5072-20240613,2024-06-13,PRD-04,afternoon,OP-1674,INSP-0024,2024-06-13T16:10:00,INS-3452,71.2,foreign_object,1,1,false,"Minor foreign object detected, batch approved.",Factory-G9
Y6938-20240613,2024-06-13,PRD-03,night,OP-5691,INSP-0025,2024-06-14T02:05:00,INS-5648,58.9,cracking,3,5,true,"Cracking observed, batch requires rework.",Factory-E1
Z4039-20240614,2024-06-14,PRD-02,afternoon,OP-2517,INSP-0026,2024-06-14T14:50:00,INS-5691,95,,,0,false,Batch PRD-02 meets all specs. No defects.,Factory-A2
A5016-20240614,2024-06-14,PRD-01,morning,OP-0033,INSP-0027,2024-06-14T09:35:00,INS-4178,80.4,discoloration,2,1,false,"Discoloration noted, batch approved.",Factory-Z3
B2783-20240615,2024-06-15,PRD-03,afternoon,OP-2186,INSP-0028,2024-06-15T14:35:00,INS-2517,67.3,misalignment,4,10,true,"Misalignment detected, batch failed.",Factory-Y7
C5401-20240615,2024-06-15,PRD-04,morning,OP-7777,INSP-0029,2024-06-15T08:40:00,INS-0112,97.8,,,0,false,"No defects, batch passed.",Factory-X0
D3094-20240616,2024-06-16,PRD-01,afternoon,OP-1674,INSP-0030,2024-06-16T15:15:00,INS-3452,86.7,,,0,false,Batch PRD-01 meets standards.,Factory-G9
E8257-20240616,2024-06-16,PRD-03,night,OP-5691,INSP-0031,2024-06-17T02:12:00,INS-5648,49.7,contamination,3,6,true,Batch requires rework due to contamination.,Factory-E1
F6324-20240617,2024-06-17,PRD-02,afternoon,OP-2517,INSP-0032,2024-06-17T14:37:00,INS-5691,89.1,,,0,false,Batch PRD-02 cleared for shipment.,Factory-A2
G9310-20240617,2024-06-17,PRD-04,morning,OP-0033,INSP-0033,2024-06-17T10:10:00,INS-4178,74.5,scratch,1,2,false,"Minor scratch observed, batch passes.",Factory-Z3
H4281-20240618,2024-06-18,PRD-01,afternoon,OP-2186,INSP-0034,2024-06-18T16:00:00,INS-2517,99.1,,,0,false,"Batch meets all requirements, no defects.",Factory-Y7
I9512-20240618,2024-06-18,PRD-03,morning,OP-7777,INSP-0035,2024-06-18T08:25:00,INS-0112,85.6,,,0,false,No issues detected in morning shift batch.,Factory-X0
J7810-20240619,2024-06-19,PRD-02,night,OP-1674,INSP-0036,2024-06-20T01:49:00,INS-3452,52.3,mislabel,3,5,true,"Batch failed due to mislabel, rework required.",Factory-G9
K4018-20240619,2024-06-19,PRD-01,afternoon,OP-5691,INSP-0037,2024-06-19T14:25:00,INS-5648,62.8,misalignment,4,8,true,"Misalignment detected, batch sent for rework.",Factory-E1
L2384-20240620,2024-06-20,PRD-03,morning,OP-2517,INSP-0038,2024-06-20T10:30:00,INS-5691,99.7,,,0,false,Batch PRD-03 rated excellent.,Factory-A2
M6097-20240620,2024-06-20,PRD-04,afternoon,OP-0033,INSP-0039,2024-06-20T16:10:00,INS-4178,83.9,marking,2,1,false,"Minor marking noted in batch, within tolerance.",Factory-Z3
N1839-20240621,2024-06-21,PRD-01,morning,OP-2186,INSP-0040,2024-06-21T09:10:00,INS-2517,100,,,0,false,"Perfect batch, no defects.",Factory-Y7
O8342-20240621,2024-06-21,PRD-03,night,OP-7777,INSP-0041,2024-06-22T01:30:00,INS-0112,98.2,,,0,false,Batch passed all inspections with high score.,Factory-X0
P3295-20240622,2024-06-22,PRD-02,afternoon,OP-1674,INSP-0042,2024-06-22T15:40:00,INS-3452,81.7,scratch,1,1,false,"Light scratch observed, batch passes.",Factory-G9
Q5091-20240622,2024-06-22,PRD-04,morning,OP-5691,INSP-0043,2024-06-22T11:15:00,INS-5648,92.3,,,0,false,Batch PRD-04 is approved for shipment.,Factory-E1
R2806-20240623,2024-06-23,PRD-01,afternoon,OP-2517,INSP-0044,2024-06-23T14:10:00,INS-5691,60.4,misalignment,4,9,true,"Severe misalignment detected, batch sent for rework.",Factory-A2
S1935-20240623,2024-06-23,PRD-03,night,OP-0033,INSP-0045,2024-06-24T02:40:00,INS-4178,6.3,major_crack,4,19,true,Complete failure. Batch will be discarded.,Factory-Z3
T8452-20240624,2024-06-24,PRD-04,morning,OP-2186,INSP-0046,2024-06-24T08:55:00,INS-2517,97.5,,,0,false,No defects found during inspection.,Factory-Y7
U3917-20240624,2024-06-24,PRD-01,afternoon,OP-7777,INSP-0047,2024-06-24T15:23:00,INS-0112,76.9,dent,2,1,false,"Minor dent found, batch passes.",Factory-X0
V8093-20240625,2024-06-25,PRD-03,night,OP-1674,INSP-0048,2024-06-26T00:03:00,INS-3452,47.5,contamination,3,6,true,Batch failed due to contamination.,Factory-G9
W5076-20240625,2024-06-25,PRD-02,afternoon,OP-5691,INSP-0049,2024-06-25T14:57:00,INS-5648,98.2,,,0,false,Batch PRD-02 meets all benchmarks.,Factory-E1
X1834-20240626,2024-06-26,PRD-01,morning,OP-2517,INSP-0050,2024-06-26T11:13:00,INS-5691,100,,,0,false,"Exceptional batch, no defects.",Factory-A2